{
  "id": "prod_xuxinhascoloridas",
  "slug": "xuxinhas-coloridas",
  "nome": "Xuxinhas coloridas",
  "categoria": "acessorio",
  "descricaoCurta": "Praticidade sem destruir com seu visual.",
  "descricaoCompleta": "Temos várias estampas e tamanhos. Consulte se ainda há o modelo que deseja. ",
  "composicao": {
    "tecido": "84% a 85% Poliamida e 15% a 16% Elastano",
    "paisDeFabricacao": "Brasil"
  },
  "cores": [
    {
      "nome": "colorido",
      "hex": "#F279C8",
      "imagens": [
        {
          "arquivo": "xuxinhas-coloridas-1.webp",
          "alt": "Xuxinhas coloridas - foto 1",
          "proporcao": "3:4"
        },
        {
          "arquivo": "xuxinhas-coloridas-2.webp",
          "alt": "Xuxinhas coloridas - foto 2",
          "proporcao": "3:4"
        },
        {
          "arquivo": "xuxinhas-coloridas-3.webp",
          "alt": "Xuxinhas coloridas - foto 3",
          "proporcao": "3:4"
        },
        {
          "arquivo": "xuxinhas-coloridas-4.webp",
          "alt": "Xuxinhas coloridas - foto 4",
          "proporcao": "3:4"
        },
        {
          "arquivo": "xuxinhas-coloridas-5.webp",
          "alt": "Xuxinhas coloridas - foto 5",
          "proporcao": "3:4"
        },
        {
          "arquivo": "xuxinhas-coloridas-6.webp",
          "alt": "Xuxinhas coloridas - foto 6",
          "proporcao": "3:4"
        }
      ]
    }
  ],
  "tamanhos": [
    "M"
  ],
  "preco": {
    "valor": 10,
    "parcelamento": ""
  },
  "imagens": [
    {
      "arquivo": "xuxinhas-coloridas-1.webp",
      "alt": "Xuxinhas coloridas - foto 1",
      "proporcao": "3:4"
    },
    {
      "arquivo": "xuxinhas-coloridas-2.webp",
      "alt": "Xuxinhas coloridas - foto 2",
      "proporcao": "3:4"
    },
    {
      "arquivo": "xuxinhas-coloridas-3.webp",
      "alt": "Xuxinhas coloridas - foto 3",
      "proporcao": "3:4"
    },
    {
      "arquivo": "xuxinhas-coloridas-4.webp",
      "alt": "Xuxinhas coloridas - foto 4",
      "proporcao": "3:4"
    },
    {
      "arquivo": "xuxinhas-coloridas-5.webp",
      "alt": "Xuxinhas coloridas - foto 5",
      "proporcao": "3:4"
    },
    {
      "arquivo": "xuxinhas-coloridas-6.webp",
      "alt": "Xuxinhas coloridas - foto 6",
      "proporcao": "3:4"
    }
  ],
  "badges": [
    "ultimas-unidades"
  ],
  "tags": [
    "xuxinha"
  ],
  "status": "publicado",
  "dataCriacao": "2026-08-19"
}
