{
  "id": "prod_conjuntodetreinoshortetopcintila",
  "slug": "conjunto-de-treino-short-e-top-cintila",
  "nome": "Conjunto de treino Short e Top Cintila",
  "categoria": "conjunto",
  "descricaoCurta": "Possui excelente compressão, proporcionando firmeza, sustentação e segurança mesmo durante treinos de alto impacto.",
  "descricaoCompleta": "Conjunto de short e top ideal para treinos, corrida, academia e diversas atividades esportivas. Possui excelente compressão, proporcionando firmeza, sustentação e segurança mesmo durante treinos de alto impacto.\r\nConfeccionado em tecido liso, com toque acetinado, que combina conforto, elasticidade e um acabamento sofisticado para você treinar com liberdade e estilo.",
  "composicao": {
    "tecido": "84% a 85% Poliamida e 15% a 16% Elastano",
    "paisDeFabricacao": "Brasil"
  },
  "cores": [
    {
      "nome": "Roxo cintilante",
      "hex": "#F279C8",
      "imagens": [
        {
          "arquivo": "conjunto-de-treino-short-e-top-cintila.webp",
          "alt": "Conjunto de treino Short e Top Cintila",
          "proporcao": "3:4"
        }
      ]
    }
  ],
  "tamanhos": [
    "M"
  ],
  "preco": {
    "valor": 140,
    "parcelamento": "2x sem juros = 70 reais"
  },
  "imagens": [
    {
      "arquivo": "conjunto-de-treino-short-e-top-cintila.webp",
      "alt": "Conjunto de treino Short e Top Cintila",
      "proporcao": "3:4"
    }
  ],
  "badges": [
    "ultimas-unidades"
  ],
  "tags": [
    "conjunto de academia",
    "short e top"
  ],
  "status": "publicado",
  "dataCriacao": "2026-08-19"
}
