{
  "id": "prod_xuxinhasegredoestamp",
  "slug": "xuxinha-segredo-estamp",
  "nome": "Xuxinha Segredo Estamp",
  "categoria": "acessorio",
  "descricaoCurta": "Xuxinha Segredo — Praticidade que acompanha você",
  "descricaoCompleta": "A Xuxinha Segredo é o acessório perfeito para quem gosta de praticidade, segurança e liberdade durante a rotina. Além de prender o cabelo com estilo, ela possui um compartimento discreto e funcional, ideal para guardar pequenos itens essenciais, como dinheiro, cartões e chaves.\r\nPerfeita para caminhadas, corridas, academia, treinos e atividades ao ar livre, ela permite que você leve o necessário sem precisar carregar bolsa ou pochete.\r\nDestaques:\r\n✨ Xuxinha de cabelo com compartimento secreto\r\n🔑 Espaço para guardar chaves\r\n💵 Ideal para dinheiro e pequenos objetos\r\n🏃‍♀️ Perfeita para caminhada, corrida e academia\r\n🎒 Dispensa o uso de bolsa durante o treino\r\n💖 Prática, discreta e funcional\r\n🔒 Mantém seus pequenos pertences sempre por perto\r\nXuxinha Segredo: seu cabelo preso e seus essenciais sempre com você.\r\n\r\n",
  "composicao": {
    "tecido": "84% a 85% Poliamida e 15% a 16% Elastano",
    "paisDeFabricacao": "Brasil"
  },
  "cores": [
    {
      "nome": "colorido",
      "hex": "#F279C8",
      "imagens": [
        {
          "arquivo": "xuxinha-segredo-estamp-1.webp",
          "alt": "Xuxinha Segredo Estamp",
          "proporcao": "3:4"
        },
        {
          "arquivo": "xuxinha-segredo-estamp-2.webp",
          "alt": "Xuxinha Segredo Estamp",
          "proporcao": "3:4"
        },
        {
          "arquivo": "xuxinha-segredo-estamp-3.webp",
          "alt": "Xuxinha Segredo Estamp",
          "proporcao": "3:4"
        }
      ]
    }
  ],
  "tamanhos": [
    "M"
  ],
  "preco": {
    "valor": 15,
    "parcelamento": ""
  },
  "imagens": [
    {
      "arquivo": "xuxinha-segredo-estamp-1.webp",
      "alt": "Xuxinha Segredo Estamp",
      "proporcao": "3:4"
    },
    {
      "arquivo": "xuxinha-segredo-estamp-2.webp",
      "alt": "Xuxinha Segredo Estamp",
      "proporcao": "3:4"
    },
    {
      "arquivo": "xuxinha-segredo-estamp-3.webp",
      "alt": "Xuxinha Segredo Estamp",
      "proporcao": "3:4"
    }
  ],
  "badges": [
    "ultimas-unidades"
  ],
  "tags": [
    "xuxinha"
  ],
  "status": "publicado",
  "dataCriacao": "2026-08-19"
}
